{
  "schema_version": "heimserver-service-expectation.v1",
  "host": "heimserver-golden",
  "scope": "artifact-derived",
  "expected_services": [
    {
      "service_name": "blocked.service",
      "expected_role": "workload"
    },
    {
      "service_name": "inconclusive.service",
      "expected_role": "workload"
    }
  ]
}
