{
  "schema_version": "heimserver-service-expectation.v1",
  "host": "heimserver-golden",
  "scope": "artifact-derived",
  "expected_services": [
    {
      "service_name": "tailscaled.service",
      "expected_role": "network"
    },
    {
      "service_name": "s2.service",
      "expected_role": "r2"
    }
  ]
}
